ID;title;author_ID;language;pages;publisher;startDate;endDate;readingStatus
1;Angelfall;1;English;200;Skyscape;;;ToBeRead
2;O Tempo e o Vento: O Continente;2;Portuguese;550;Companhia das Letras;2020-04-03;2020-04-29;Read
3;Sapiens: Uma Breve Historia da Humanidade;3;Portuguese;600;LPM Editores;2020-06-23;2020-07-15;Read
4;O Tempo e o Vento: O Retrato;2;Portuguese;490; Companhia das Letras;;;ToBeRead
5;Em busca de sentido;4;Portuguese;200;Editora Vozes;2020-12-21;;Reading
6;Crepusculo dos Idolos;5;Portuguese;180;Companhia de Bolso;2019-10-12;2019-11-01;PartiallyRead